
<xs:schema xmlns:xs="http://www.w3.org/2001/XMLSchema" elementFormDefault="qualified" attributeFormDefault="unqualified">
	<xs:element name="system.columns_root">
		<xs:complexType>
			<xs:sequence>
				<xs:element name="system.columns" minOccurs="0" maxOccurs="unbounded">
					<xs:complexType>
						<xs:sequence>
							<xs:element name="column_id"  minOccurs="1" maxOccurs="1">
								<xs:simpleType>
									<xs:restriction base = "xs:int"/>
								</xs:simpleType>
							</xs:element>
							<xs:element name="column_name"  minOccurs="1" maxOccurs="1">
								<xs:simpleType>
									<xs:restriction base = "xs:string">
										<xs:minLength value="0"/>
										<xs:maxLength value="128"/>
									</xs:restriction>
								</xs:simpleType>
							</xs:element>
							<xs:element name="table_id"  minOccurs="1" maxOccurs="1">
								<xs:simpleType>
									<xs:restriction base = "xs:int"/>
								</xs:simpleType>
							</xs:element>
							<xs:element name="data_type"  minOccurs="1" maxOccurs="1">
								<xs:simpleType>
									<xs:restriction base = "xs:short"/>
								</xs:simpleType>
							</xs:element>
							<xs:element name="type_name"  minOccurs="1" maxOccurs="1">
								<xs:simpleType>
									<xs:restriction base = "xs:string">
										<xs:minLength value="0"/>
										<xs:maxLength value="128"/>
									</xs:restriction>
								</xs:simpleType>
							</xs:element>
							<xs:element name="column_size"  minOccurs="0" maxOccurs="1">
								<xs:simpleType>
									<xs:restriction base = "xs:int"/>
								</xs:simpleType>
							</xs:element>
							<xs:element name="buffer_length"  minOccurs="0" maxOccurs="1">
								<xs:simpleType>
									<xs:restriction base = "xs:int"/>
								</xs:simpleType>
							</xs:element>
							<xs:element name="decimal_digits"  minOccurs="0" maxOccurs="1">
								<xs:simpleType>
									<xs:restriction base = "xs:short"/>
								</xs:simpleType>
							</xs:element>
							<xs:element name="num_prec_radix"  minOccurs="0" maxOccurs="1">
								<xs:simpleType>
									<xs:restriction base = "xs:short"/>
								</xs:simpleType>
							</xs:element>
							<xs:element name="nullable"  minOccurs="1" maxOccurs="1">
								<xs:simpleType>
									<xs:restriction base = "xs:short"/>
								</xs:simpleType>
							</xs:element>
							<xs:element name="remarks"  minOccurs="0" maxOccurs="1">
								<xs:simpleType>
									<xs:restriction base = "xs:string">
										<xs:minLength value="0"/>
										<xs:maxLength value="128"/>
									</xs:restriction>
								</xs:simpleType>
							</xs:element>
							<xs:element name="column_def"  minOccurs="0" maxOccurs="1">
								<xs:simpleType>
									<xs:restriction base = "xs:string">
										<xs:minLength value="0"/>
										<xs:maxLength value="128"/>
									</xs:restriction>
								</xs:simpleType>
							</xs:element>
							<xs:element name="date_time_code"  minOccurs="0" maxOccurs="1">
								<xs:simpleType>
									<xs:restriction base = "xs:int"/>
								</xs:simpleType>
							</xs:element>
							<xs:element name="char_octet_length"  minOccurs="0" maxOccurs="1">
								<xs:simpleType>
									<xs:restriction base = "xs:int"/>
								</xs:simpleType>
							</xs:element>
							<xs:element name="ordinal_position"  minOccurs="1" maxOccurs="1">
								<xs:simpleType>
									<xs:restriction base = "xs:int"/>
								</xs:simpleType>
							</xs:element>
							<xs:element name="is_nullable"  minOccurs="0" maxOccurs="1">
								<xs:simpleType>
									<xs:restriction base = "xs:string">
										<xs:minLength value="0"/>
										<xs:maxLength value="254"/>
									</xs:restriction>
								</xs:simpleType>
							</xs:element>
						</xs:sequence>
					</xs:complexType>
					<xs:key name="XPKsystem.columns">
						<xs:selector xpath=".//system.columns"/>
						<xs:field xpath="column_id"/>
					</xs:key>
				</xs:element>
			</xs:sequence>
		</xs:complexType>
	</xs:element>
</xs:schema>
